{
  "$schema": "https://embeddedos.org/schemas/devboard-cad/v1/board-record.schema.json",
  "contract_version": "1.1.0",
  "board_id": "raspberry-pi:zero-w",
  "manufacturer": "Raspberry Pi",
  "family": "Raspberry Pi Zero W",
  "board": "Raspberry Pi Zero W",
  "part_number": "UNVERIFIED",
  "revision": "unverified",
  "mcu_soc": "Broadcom BCM2835",
  "hardware_revision": null,
  "fpga": null,
  "cpu_architecture": "Arm1176JZF-S",
  "product_status": "unknown",
  "files": {
    "mechanical": {
      "available": true,
      "url": "https://pip.raspberrypi.com/documents/RP-008367-DS",
      "verified_revision": null,
      "evidence": {
        "captured_at": "2026-09-29T07:21:43Z",
        "producer_tool_id": "devboard-cad-verifier@0.1.0",
        "http_status": 200,
        "source_url": "https://pip-assets.raspberrypi.com/categories/592-raspberry-pi-zero-w/documents/RP-008367-DS-1-raspberry-pi-zero-w-mechanical-drawing.pdf",
        "sha256": "35f3760a5928a9ff8732f0cf1df6a216b3a66930d56cdf46362091ad47386645",
        "size_bytes": 15424,
        "media_type": "application/pdf",
        "detected_format": "pdf",
        "verification_method": "http_get_magic"
      }
    },
    "schematic": {
      "available": true,
      "url": "https://pip.raspberrypi.com/documents/RP-008368-DS",
      "verified_revision": null,
      "evidence": {
        "captured_at": "2026-09-29T07:21:44Z",
        "producer_tool_id": "devboard-cad-verifier@0.1.0",
        "http_status": 200,
        "source_url": "https://pip-assets.raspberrypi.com/categories/592-raspberry-pi-zero-w/documents/RP-008368-DS-1-raspberry-pi-zero-w-reduced-schematics.pdf",
        "sha256": "737fdb376ee876b049d9523e1fc0e4098c3ac9707bbd2468f668f08326709816",
        "size_bytes": 182677,
        "media_type": "application/pdf",
        "detected_format": "pdf",
        "verification_method": "http_get_magic"
      }
    },
    "pcb_source": {
      "available": null,
      "url": null,
      "verified_revision": null,
      "evidence": null
    },
    "gerbers": {
      "available": null,
      "url": null,
      "verified_revision": null,
      "evidence": null
    },
    "bom": {
      "available": null,
      "url": null,
      "verified_revision": null,
      "evidence": null
    }
  },
  "licenses": {
    "hardware_license": "UNVERIFIED",
    "cad_license": null,
    "schematic_license": null,
    "pcb_license": null,
    "mechanical_cad_license": null,
    "redistribution_allowed": null,
    "modification_allowed": null,
    "commercial_use_allowed": null,
    "attribution_required": null,
    "license_url": null
  },
  "sources": {
    "source_tier": "manufacturer_official",
    "official_product_page": "https://www.raspberrypi.com/products/",
    "official_cad_repository": null,
    "official_github_repository": null,
    "official_documentation": "https://www.raspberrypi.com/documentation/computers/raspberry-pi.html",
    "direct_cad_download": null,
    "direct_schematic_download": "https://pip.raspberrypi.com/documents/RP-008368-DS",
    "direct_gerber_download": null
  },
  "record_status": "partial",
  "notes": "Candidate URLs curated from the manufacturer's official documentation; availability is decided by verify.py from retrieved bytes. Unlike a repository tree this list is not exhaustive, so formats absent from it are recorded as unknown rather than absent. URLs extracted from raspberrypi/documentation@b47f68f."
}
