{
  "$schema": "https://embeddedos.org/schemas/devboard-cad/v1/board-record.schema.json",
  "contract_version": "1.1.0",
  "board_id": "sparkfun:micromod-function-ethernet-w5500",
  "manufacturer": "SparkFun Electronics",
  "family": "MicroMod",
  "board": "SparkFun MicroMod Function Ethernet W5500",
  "part_number": "COM-18708",
  "revision": "not-stated",
  "mcu_soc": "UNVERIFIED",
  "hardware_revision": null,
  "fpga": null,
  "cpu_architecture": null,
  "product_status": "unknown",
  "files": {
    "altium": {
      "available": false,
      "url": null,
      "verified_revision": null,
      "evidence": {
        "sha256": null,
        "captured_at": "2026-09-29T07:07:56Z",
        "producer_tool_id": "devboard-cad-github-harvester@0.1.0",
        "verification_method": "official_index_absent",
        "index_ref": "sparkfun/MicroMod_Function_Ethernet-W5500@6b66bf3d9790e4a96c8c1b94a1cd176725633be2"
      }
    },
    "bom": {
      "available": false,
      "url": null,
      "verified_revision": null,
      "evidence": {
        "sha256": null,
        "captured_at": "2026-09-29T07:07:56Z",
        "producer_tool_id": "devboard-cad-github-harvester@0.1.0",
        "verification_method": "official_index_absent",
        "index_ref": "sparkfun/MicroMod_Function_Ethernet-W5500@6b66bf3d9790e4a96c8c1b94a1cd176725633be2"
      }
    },
    "datasheet": {
      "available": true,
      "url": "https://raw.githubusercontent.com/sparkfun/MicroMod_Function_Ethernet-W5500/6b66bf3d9790e4a96c8c1b94a1cd176725633be2/Documents/Ag9900M-datasheet-ultra-miniature-isolated-Power-over-Ethernet-POE-module.pdf",
      "verified_revision": null,
      "evidence": {
        "captured_at": "2026-09-29T07:20:50Z",
        "producer_tool_id": "devboard-cad-verifier@0.1.0",
        "http_status": 200,
        "sha256": "c7a4c0f834810c6677da54079e318814757caa9cc82a6bdc5f40e35c30ee9b41",
        "size_bytes": 1074077,
        "media_type": "application/octet-stream",
        "detected_format": "pdf",
        "verification_method": "http_get_magic"
      }
    },
    "dxf": {
      "available": false,
      "url": null,
      "verified_revision": null,
      "evidence": {
        "sha256": null,
        "captured_at": "2026-09-29T07:07:56Z",
        "producer_tool_id": "devboard-cad-github-harvester@0.1.0",
        "verification_method": "official_index_absent",
        "index_ref": "sparkfun/MicroMod_Function_Ethernet-W5500@6b66bf3d9790e4a96c8c1b94a1cd176725633be2"
      }
    },
    "eagle": {
      "available": true,
      "url": "https://raw.githubusercontent.com/sparkfun/MicroMod_Function_Ethernet-W5500/6b66bf3d9790e4a96c8c1b94a1cd176725633be2/Hardware/MicroMod-Ethernet-Function-Board-W5500.brd",
      "verified_revision": null,
      "evidence": {
        "captured_at": "2026-09-29T07:20:50Z",
        "producer_tool_id": "devboard-cad-verifier@0.1.0",
        "http_status": 200,
        "sha256": "a98d76c02f365bbd1cb4750af61ec419226e69e1e082afb0ec871ddda47d4603",
        "size_bytes": 390937,
        "media_type": "text/plain",
        "detected_format": "eagle",
        "verification_method": "http_get_magic"
      }
    },
    "gerbers": {
      "available": true,
      "url": "https://raw.githubusercontent.com/sparkfun/MicroMod_Function_Ethernet-W5500/6b66bf3d9790e4a96c8c1b94a1cd176725633be2/Hardware/Production/MicroMod-Ethernet-Function-Board-W5500-Panel.zip",
      "verified_revision": null,
      "evidence": {
        "captured_at": "2026-09-29T07:20:50Z",
        "producer_tool_id": "devboard-cad-verifier@0.1.0",
        "http_status": 200,
        "sha256": "cbc75b143c49a094838e27580ac5066bbfdd9ab875cf7349bd6ba310dd12ca32",
        "size_bytes": 1238347,
        "media_type": "application/zip",
        "detected_format": "zip",
        "verification_method": "http_get_archive_member",
        "contained_member": "MicroMod-Ethernet-Function-Board-Panel.GBL"
      }
    },
    "kicad": {
      "available": false,
      "url": null,
      "verified_revision": null,
      "evidence": {
        "sha256": null,
        "captured_at": "2026-09-29T07:07:56Z",
        "producer_tool_id": "devboard-cad-github-harvester@0.1.0",
        "verification_method": "official_index_absent",
        "index_ref": "sparkfun/MicroMod_Function_Ethernet-W5500@6b66bf3d9790e4a96c8c1b94a1cd176725633be2"
      }
    },
    "mechanical": {
      "available": false,
      "url": null,
      "verified_revision": null,
      "evidence": {
        "sha256": null,
        "captured_at": "2026-09-29T07:07:56Z",
        "producer_tool_id": "devboard-cad-github-harvester@0.1.0",
        "verification_method": "official_index_absent",
        "index_ref": "sparkfun/MicroMod_Function_Ethernet-W5500@6b66bf3d9790e4a96c8c1b94a1cd176725633be2"
      }
    },
    "nc_drill": {
      "available": false,
      "url": null,
      "verified_revision": null,
      "evidence": {
        "sha256": null,
        "captured_at": "2026-09-29T07:07:56Z",
        "producer_tool_id": "devboard-cad-github-harvester@0.1.0",
        "verification_method": "official_index_absent",
        "index_ref": "sparkfun/MicroMod_Function_Ethernet-W5500@6b66bf3d9790e4a96c8c1b94a1cd176725633be2"
      }
    },
    "pcb_source": {
      "available": true,
      "url": "https://raw.githubusercontent.com/sparkfun/MicroMod_Function_Ethernet-W5500/6b66bf3d9790e4a96c8c1b94a1cd176725633be2/Hardware/MicroMod-Ethernet-Function-Board-W5500.brd",
      "verified_revision": null,
      "evidence": {
        "captured_at": "2026-09-29T07:20:50Z",
        "producer_tool_id": "devboard-cad-verifier@0.1.0",
        "http_status": 200,
        "sha256": "a98d76c02f365bbd1cb4750af61ec419226e69e1e082afb0ec871ddda47d4603",
        "size_bytes": 390937,
        "media_type": "text/plain",
        "detected_format": "eagle",
        "verification_method": "http_get_magic"
      }
    },
    "pick_and_place": {
      "available": false,
      "url": null,
      "verified_revision": null,
      "evidence": {
        "sha256": null,
        "captured_at": "2026-09-29T07:07:56Z",
        "producer_tool_id": "devboard-cad-github-harvester@0.1.0",
        "verification_method": "official_index_absent",
        "index_ref": "sparkfun/MicroMod_Function_Ethernet-W5500@6b66bf3d9790e4a96c8c1b94a1cd176725633be2"
      }
    },
    "schematic": {
      "available": true,
      "url": "https://raw.githubusercontent.com/sparkfun/MicroMod_Function_Ethernet-W5500/6b66bf3d9790e4a96c8c1b94a1cd176725633be2/Hardware/MicroMod-Ethernet-Function-Board-W5500.sch",
      "verified_revision": null,
      "evidence": {
        "captured_at": "2026-09-29T07:20:50Z",
        "producer_tool_id": "devboard-cad-verifier@0.1.0",
        "http_status": 200,
        "sha256": "a707b212cafdf13be34dc892f094268dd3ad318e51d32e7c17621b28782bebb7",
        "size_bytes": 1054430,
        "media_type": "text/plain",
        "detected_format": "eagle",
        "verification_method": "http_get_magic"
      }
    },
    "step": {
      "available": false,
      "url": null,
      "verified_revision": null,
      "evidence": {
        "sha256": null,
        "captured_at": "2026-09-29T07:07:56Z",
        "producer_tool_id": "devboard-cad-github-harvester@0.1.0",
        "verification_method": "official_index_absent",
        "index_ref": "sparkfun/MicroMod_Function_Ethernet-W5500@6b66bf3d9790e4a96c8c1b94a1cd176725633be2"
      }
    },
    "stl": {
      "available": false,
      "url": null,
      "verified_revision": null,
      "evidence": {
        "sha256": null,
        "captured_at": "2026-09-29T07:07:56Z",
        "producer_tool_id": "devboard-cad-github-harvester@0.1.0",
        "verification_method": "official_index_absent",
        "index_ref": "sparkfun/MicroMod_Function_Ethernet-W5500@6b66bf3d9790e4a96c8c1b94a1cd176725633be2"
      }
    }
  },
  "licenses": {
    "hardware_license": "UNVERIFIED",
    "cad_license": null,
    "schematic_license": null,
    "pcb_license": null,
    "mechanical_cad_license": null,
    "redistribution_allowed": null,
    "modification_allowed": null,
    "commercial_use_allowed": null,
    "attribution_required": null,
    "license_url": null
  },
  "sources": {
    "source_tier": "manufacturer_official",
    "official_product_page": "https://www.sparkfun.com/products/COM-18708",
    "official_cad_repository": "https://github.com/sparkfun/MicroMod_Function_Ethernet-W5500",
    "official_github_repository": "https://github.com/sparkfun/MicroMod_Function_Ethernet-W5500",
    "official_documentation": null,
    "direct_cad_download": null,
    "direct_schematic_download": null,
    "direct_gerber_download": null
  },
  "record_status": "partial",
  "notes": "File candidates harvested from the manufacturer's official repository sparkfun/MicroMod_Function_Ethernet-W5500 pinned at 6b66bf3d9790. Availability is decided by verify.py from retrieved bytes, never from this index. Licensing is left unverified until the vendor's terms have been read; a GitHub SPDX tag describes the repository, not necessarily the hardware."
}
