{
  "$schema": "https://embeddedos.org/schemas/devboard-cad/v1/board-record.schema.json",
  "contract_version": "1.1.0",
  "board_id": "adafruit:metro-esp32-s2",
  "manufacturer": "Adafruit Industries",
  "family": "Metro",
  "board": "Adafruit Metro ESP32-S2",
  "part_number": "4775",
  "revision": "C",
  "mcu_soc": "ESP32-S2",
  "hardware_revision": null,
  "fpga": null,
  "cpu_architecture": "Xtensa LX7",
  "product_status": "unknown",
  "files": {
    "altium": {
      "available": false,
      "url": null,
      "verified_revision": null,
      "evidence": {
        "sha256": null,
        "captured_at": "2026-09-29T07:04:29Z",
        "producer_tool_id": "devboard-cad-github-harvester@0.1.0",
        "verification_method": "official_index_absent",
        "index_ref": "adafruit/Adafruit-Metro-ESP32-S2-PCB@42dac1c66d3001a97ef5565b1fea2e842364df32"
      }
    },
    "bom": {
      "available": false,
      "url": null,
      "verified_revision": null,
      "evidence": {
        "sha256": null,
        "captured_at": "2026-09-29T07:04:29Z",
        "producer_tool_id": "devboard-cad-github-harvester@0.1.0",
        "verification_method": "official_index_absent",
        "index_ref": "adafruit/Adafruit-Metro-ESP32-S2-PCB@42dac1c66d3001a97ef5565b1fea2e842364df32"
      }
    },
    "dxf": {
      "available": false,
      "url": null,
      "verified_revision": null,
      "evidence": {
        "sha256": null,
        "captured_at": "2026-09-29T07:04:29Z",
        "producer_tool_id": "devboard-cad-github-harvester@0.1.0",
        "verification_method": "official_index_absent",
        "index_ref": "adafruit/Adafruit-Metro-ESP32-S2-PCB@42dac1c66d3001a97ef5565b1fea2e842364df32"
      }
    },
    "eagle": {
      "available": true,
      "url": "https://raw.githubusercontent.com/adafruit/Adafruit-Metro-ESP32-S2-PCB/42dac1c66d3001a97ef5565b1fea2e842364df32/Adafruit%20Metro%20ESP32-S2.brd",
      "verified_revision": null,
      "evidence": {
        "captured_at": "2026-09-29T07:14:01Z",
        "producer_tool_id": "devboard-cad-verifier@0.1.0",
        "http_status": 200,
        "sha256": "4b48df7aa268e8b522a28e03e78e552454ae7d59118a50b1737d9454ac7c0330",
        "size_bytes": 3325780,
        "media_type": "text/plain",
        "detected_format": "eagle",
        "verification_method": "http_get_magic"
      }
    },
    "gerbers": {
      "available": false,
      "url": null,
      "verified_revision": null,
      "evidence": {
        "sha256": null,
        "captured_at": "2026-09-29T07:04:29Z",
        "producer_tool_id": "devboard-cad-github-harvester@0.1.0",
        "verification_method": "official_index_absent",
        "index_ref": "adafruit/Adafruit-Metro-ESP32-S2-PCB@42dac1c66d3001a97ef5565b1fea2e842364df32"
      }
    },
    "kicad": {
      "available": false,
      "url": null,
      "verified_revision": null,
      "evidence": {
        "sha256": null,
        "captured_at": "2026-09-29T07:04:29Z",
        "producer_tool_id": "devboard-cad-github-harvester@0.1.0",
        "verification_method": "official_index_absent",
        "index_ref": "adafruit/Adafruit-Metro-ESP32-S2-PCB@42dac1c66d3001a97ef5565b1fea2e842364df32"
      }
    },
    "mechanical": {
      "available": false,
      "url": null,
      "verified_revision": null,
      "evidence": {
        "sha256": null,
        "captured_at": "2026-09-29T07:04:29Z",
        "producer_tool_id": "devboard-cad-github-harvester@0.1.0",
        "verification_method": "official_index_absent",
        "index_ref": "adafruit/Adafruit-Metro-ESP32-S2-PCB@42dac1c66d3001a97ef5565b1fea2e842364df32"
      }
    },
    "nc_drill": {
      "available": false,
      "url": null,
      "verified_revision": null,
      "evidence": {
        "sha256": null,
        "captured_at": "2026-09-29T07:04:29Z",
        "producer_tool_id": "devboard-cad-github-harvester@0.1.0",
        "verification_method": "official_index_absent",
        "index_ref": "adafruit/Adafruit-Metro-ESP32-S2-PCB@42dac1c66d3001a97ef5565b1fea2e842364df32"
      }
    },
    "pcb_source": {
      "available": true,
      "url": "https://raw.githubusercontent.com/adafruit/Adafruit-Metro-ESP32-S2-PCB/42dac1c66d3001a97ef5565b1fea2e842364df32/Adafruit%20Metro%20ESP32-S2.brd",
      "verified_revision": null,
      "evidence": {
        "captured_at": "2026-09-29T07:14:01Z",
        "producer_tool_id": "devboard-cad-verifier@0.1.0",
        "http_status": 200,
        "sha256": "4b48df7aa268e8b522a28e03e78e552454ae7d59118a50b1737d9454ac7c0330",
        "size_bytes": 3325780,
        "media_type": "text/plain",
        "detected_format": "eagle",
        "verification_method": "http_get_magic"
      }
    },
    "pick_and_place": {
      "available": false,
      "url": null,
      "verified_revision": null,
      "evidence": {
        "sha256": null,
        "captured_at": "2026-09-29T07:04:29Z",
        "producer_tool_id": "devboard-cad-github-harvester@0.1.0",
        "verification_method": "official_index_absent",
        "index_ref": "adafruit/Adafruit-Metro-ESP32-S2-PCB@42dac1c66d3001a97ef5565b1fea2e842364df32"
      }
    },
    "pinout": {
      "available": true,
      "url": "https://raw.githubusercontent.com/adafruit/Adafruit-Metro-ESP32-S2-PCB/42dac1c66d3001a97ef5565b1fea2e842364df32/Adafruit%20Metro%20ESP32-S2%20pinout.pdf",
      "verified_revision": null,
      "evidence": {
        "captured_at": "2026-09-29T07:13:59Z",
        "producer_tool_id": "devboard-cad-verifier@0.1.0",
        "http_status": 200,
        "sha256": "a69391ab5d46dde1d10c7e7491b4b5a0279f29bb8a742e59025406303ef7fdc4",
        "size_bytes": 559980,
        "media_type": "application/octet-stream",
        "detected_format": "pdf",
        "verification_method": "http_get_magic"
      }
    },
    "schematic": {
      "available": true,
      "url": "https://raw.githubusercontent.com/adafruit/Adafruit-Metro-ESP32-S2-PCB/42dac1c66d3001a97ef5565b1fea2e842364df32/Adafruit%20Metro%20ESP32-S2.sch",
      "verified_revision": null,
      "evidence": {
        "captured_at": "2026-09-29T07:13:59Z",
        "producer_tool_id": "devboard-cad-verifier@0.1.0",
        "http_status": 200,
        "sha256": "15bb54d427b607b58b9f14f94f242f098bdff306061ad527a2d1965a33bc351d",
        "size_bytes": 421991,
        "media_type": "text/plain",
        "detected_format": "eagle",
        "verification_method": "http_get_magic"
      }
    },
    "step": {
      "available": false,
      "url": null,
      "verified_revision": null,
      "evidence": {
        "sha256": null,
        "captured_at": "2026-09-29T07:04:29Z",
        "producer_tool_id": "devboard-cad-github-harvester@0.1.0",
        "verification_method": "official_index_absent",
        "index_ref": "adafruit/Adafruit-Metro-ESP32-S2-PCB@42dac1c66d3001a97ef5565b1fea2e842364df32"
      }
    },
    "stl": {
      "available": false,
      "url": null,
      "verified_revision": null,
      "evidence": {
        "sha256": null,
        "captured_at": "2026-09-29T07:04:29Z",
        "producer_tool_id": "devboard-cad-github-harvester@0.1.0",
        "verification_method": "official_index_absent",
        "index_ref": "adafruit/Adafruit-Metro-ESP32-S2-PCB@42dac1c66d3001a97ef5565b1fea2e842364df32"
      }
    }
  },
  "licenses": {
    "hardware_license": "CC BY-SA (version not stated by the manufacturer)",
    "cad_license": "CC BY-SA (version not stated by the manufacturer)",
    "schematic_license": "CC BY-SA (version not stated by the manufacturer)",
    "pcb_license": "CC BY-SA (version not stated by the manufacturer)",
    "mechanical_cad_license": "CC BY-SA (version not stated by the manufacturer)",
    "redistribution_allowed": true,
    "modification_allowed": true,
    "commercial_use_allowed": true,
    "attribution_required": true,
    "license_url": "https://github.com/adafruit/Adafruit-Metro-ESP32-S2-PCB"
  },
  "sources": {
    "source_tier": "manufacturer_official",
    "official_product_page": "https://www.adafruit.com/product/4775",
    "official_cad_repository": "https://github.com/adafruit/Adafruit-Metro-ESP32-S2-PCB",
    "official_github_repository": "https://github.com/adafruit/Adafruit-Metro-ESP32-S2-PCB",
    "official_documentation": null,
    "direct_cad_download": null,
    "direct_schematic_download": null,
    "direct_gerber_download": null
  },
  "record_status": "verified",
  "notes": "File candidates harvested from the manufacturer's official repository adafruit/Adafruit-Metro-ESP32-S2-PCB pinned at 42dac1c66d30. Availability is decided by verify.py from retrieved bytes, never from this index. Licensing is left unverified until the vendor's terms have been read; a GitHub SPDX tag describes the repository, not necessarily the hardware. Hardware licence read from adafruit/Adafruit-Metro-ESP32-S2-PCB: \"Creative Commons Attribution/Share-Alike, all text above must be included in any redistribution.\". No version is given and the license file the README points at is not present, so the version is unverified; every CC BY-SA version permits commercial use and modification under attribution and share-alike, so the permissions are recorded and the version is not."
}
